{
  "isco_code": "7411",
  "beruf": "Elektriker/in EFZ",
  "taetigkeiten": [
    {
      "name": "Rohinstallation erstellen: Rohre, Dosen und Kabelkanäle verlegen, Schlitze fräsen, Kabel einziehen",
      "zeitanteil_pct": 25,
      "stufe": "E0",
      "modus": null,
      "restzeit_mensch": null,
      "physisch_automatisierbar": "P0",
      "p_art": null,
      "sicherheit": "hoch",
      "sicherheit_begruendung": null,
      "ch_hemmnis": [],
      "begruendung": "Handwerkliche Arbeit auf der Baustelle; keine Robotik für Elektroinstallationen in relevantem Umfang verfügbar."
    },
    {
      "name": "Feininstallation ausführen: Schalter, Steckdosen, Leuchten und Geräte montieren und anschliessen",
      "zeitanteil_pct": 20,
      "stufe": "E0",
      "modus": null,
      "restzeit_mensch": null,
      "physisch_automatisierbar": "P0",
      "p_art": null,
      "sicherheit": "hoch",
      "sicherheit_begruendung": null,
      "ch_hemmnis": [],
      "begruendung": "Physische Präzisionsarbeit vor Ort; nicht automatisierbar."
    },
    {
      "name": "Verteilungen und Unterverteilungen bestücken, verdrahten und beschriften",
      "zeitanteil_pct": 10,
      "stufe": "E0",
      "modus": null,
      "restzeit_mensch": null,
      "physisch_automatisierbar": "P0",
      "p_art": null,
      "sicherheit": "hoch",
      "sicherheit_begruendung": null,
      "ch_hemmnis": [],
      "begruendung": "Handarbeit am Verteiler; automatisierte Verdrahtung gibt es nur im industriellen Schaltanlagenbau, nicht für die Arbeit vor Ort."
    },
    {
      "name": "Installationen messen und prüfen (Isolations-, Schleifen- und FI-Messung) und in Betrieb nehmen",
      "zeitanteil_pct": 10,
      "stufe": "E0",
      "modus": null,
      "restzeit_mensch": null,
      "physisch_automatisierbar": "P0",
      "p_art": null,
      "sicherheit": "hoch",
      "sicherheit_begruendung": null,
      "ch_hemmnis": [],
      "begruendung": "Messungen mit Installationstestern vor Ort an jedem Stromkreis; die Messgeräte erleichtern, ersetzen die Person aber nicht."
    },
    {
      "name": "Störungen an Anlagen und Geräten vor Ort eingrenzen und beheben (Servicedienst, Reparaturen)",
      "zeitanteil_pct": 10,
      "stufe": "E0",
      "modus": null,
      "restzeit_mensch": null,
      "physisch_automatisierbar": "P0",
      "p_art": null,
      "sicherheit": "hoch",
      "sicherheit_begruendung": null,
      "ch_hemmnis": [],
      "begruendung": "Fehlersuche durch Messen, Öffnen und Tauschen vor Ort; ein LLM kann Hinweise geben, spart aber nicht 50 % der Zeit."
    },
    {
      "name": "Mess- und Prüfprotokolle sowie Sicherheitsnachweis erstellen",
      "zeitanteil_pct": 5,
      "stufe": "E2",
      "modus": "delegierend",
      "restzeit_mensch": "30-50",
      "physisch_automatisierbar": "P0",
      "p_art": null,
      "sicherheit": "mittel",
      "sicherheit_begruendung": null,
      "ch_hemmnis": ["regulatorisch"],
      "begruendung": "Messwerte per Geräteexport, Foto oder Spracheingabe in die Protokoll-App; die App erstellt Protokoll und Bemerkungen, der Elektriker prüft jedes Protokoll und unterschreibt. Hemmnis: Unterschriftspflicht und Haftung nach NIV."
    },
    {
      "name": "Arbeits- und Regierapporte mit Arbeitsbeschrieb, Material und Stunden erstellen",
      "zeitanteil_pct": 5,
      "stufe": "E2",
      "modus": "delegierend",
      "restzeit_mensch": "30-50",
      "physisch_automatisierbar": "P0",
      "p_art": null,
      "sicherheit": "mittel",
      "sicherheit_begruendung": null,
      "ch_hemmnis": [],
      "begruendung": "Spracheingabe oder Fotos in der Rapport-App erzeugen Arbeitsbeschrieb und Materialliste; der Elektriker prüft und korrigiert jeden Rapport. Dialekt und Baustellenlärm erhöhen den Korrekturaufwand."
    },
    {
      "name": "Elektropläne und Schemas lesen, Installation vor Ort einteilen und anzeichnen",
      "zeitanteil_pct": 5,
      "stufe": "E0",
      "modus": null,
      "restzeit_mensch": null,
      "physisch_automatisierbar": "P0",
      "p_art": null,
      "sicherheit": "mittel",
      "sicherheit_begruendung": null,
      "ch_hemmnis": [],
      "begruendung": "Die Zeit liegt im Übertragen und Anzeichnen am Bau; Bildverständnis von Plänen spart dabei keine 50 %."
    },
    {
      "name": "Material rüsten, zur Baustelle transportieren, Arbeitsplatz einrichten und aufräumen",
      "zeitanteil_pct": 5,
      "stufe": "E0",
      "modus": null,
      "restzeit_mensch": null,
      "physisch_automatisierbar": "P0",
      "p_art": null,
      "sicherheit": "hoch",
      "sicherheit_begruendung": null,
      "ch_hemmnis": [],
      "begruendung": "Physische Tätigkeit; keine relevante Automatisierung für das Rüsten im Kleinbetrieb."
    },
    {
      "name": "Mit Bauleitung, anderen Gewerken und Kundschaft vor Ort Ausführung absprechen und Lernende anleiten",
      "zeitanteil_pct": 5,
      "stufe": "E0",
      "modus": null,
      "restzeit_mensch": null,
      "physisch_automatisierbar": "P0",
      "p_art": null,
      "sicherheit": "hoch",
      "sicherheit_begruendung": null,
      "ch_hemmnis": [],
      "begruendung": "Persönliche Abstimmung und Anleitung vor Ort; Präsenztätigkeit."
    }
  ],
  "unsicherheit": "niedrig",
  "kommentar": "Setting: Elektroinstallateur/in EFZ in einem Elektroinstallations-KMU, Neubau/Umbau mit etwas Servicedienst. ESCO (Bauelektriker) passt gut; Wissensgebiete (Schaltbilder, Gebäudeüberwachung) nur als Hinweis genutzt. Grenzfälle sind nur die kleinen Dokumentationstätigkeiten (Protokolle, Rapporte)."
}
