{
  "isco_code": "4110",
  "beruf": "Kaufmann/-frau EFZ (allg. Richtung)",
  "taetigkeiten": [
    {
      "name": "E-Mails und Briefe an Kundschaft und Lieferanten verfassen und beantworten (Anfragen, Bestätigungen, Standardkorrespondenz)",
      "zeitanteil_pct": 15,
      "stufe": "E1",
      "modus": "ersetzend",
      "restzeit_mensch": "10-30",
      "physisch_automatisierbar": "P0",
      "p_art": null,
      "sicherheit": "mittel",
      "sicherheit_begruendung": null,
      "ch_hemmnis": [],
      "begruendung": "Anfrage und Stichworte ins Chat-LLM kopieren, das LLM formuliert die Antwort; die Person sichtet kurz und versendet. Anteil individueller Fälle mit Nachrecherche hält die Restzeit über 10 %."
    },
    {
      "name": "Telefonanrufe entgegennehmen, Auskünfte geben und Anliegen weiterleiten",
      "zeitanteil_pct": 10,
      "stufe": "E0",
      "modus": null,
      "restzeit_mensch": null,
      "physisch_automatisierbar": "P0",
      "p_art": null,
      "sicherheit": "tief",
      "sicherheit_begruendung": "Unklar, ob ein Voicebot im KMU mit Schweizerdeutsch und vielfältigen Anliegen 50 % spart; E2 ersetzend ebenso plausibel.",
      "ch_hemmnis": [],
      "begruendung": "Im typischen KMU sind Anrufe vielfältig und nicht standardisiert; die Dialektqualität von Voicebots in freien Gesprächen reicht nach bester Einschätzung noch nicht für die Schwelle."
    },
    {
      "name": "Besucherinnen und Kundschaft am Empfang begrüssen, betreuen und Sitzungsräume bereitstellen",
      "zeitanteil_pct": 5,
      "stufe": "E0",
      "modus": null,
      "restzeit_mensch": null,
      "physisch_automatisierbar": "P0",
      "p_art": null,
      "sicherheit": "hoch",
      "sicherheit_begruendung": null,
      "ch_hemmnis": [],
      "begruendung": "Persönliche Präsenz und physische Vorbereitung; keine relevante Automatisierung im KMU."
    },
    {
      "name": "Bestellungen und Aufträge aus E-Mails und PDF-Dokumenten im ERP erfassen",
      "zeitanteil_pct": 10,
      "stufe": "E2",
      "modus": "ersetzend",
      "restzeit_mensch": "10-30",
      "physisch_automatisierbar": "P0",
      "p_art": null,
      "sicherheit": "mittel",
      "sicherheit_begruendung": null,
      "ch_hemmnis": [],
      "begruendung": "KI-Dokumentenverarbeitung extrahiert Positionen und legt den Auftrag im ERP an; die Person bearbeitet markierte Ausnahmen (unbekannte Artikel, Abweichungen). Heterogene Formate übersteigen klassische Formularerkennung."
    },
    {
      "name": "Offerten und Auftragsbestätigungen im ERP zusammenstellen und mit Begleittext versenden",
      "zeitanteil_pct": 10,
      "stufe": "E2",
      "modus": "delegierend",
      "restzeit_mensch": "30-50",
      "physisch_automatisierbar": "P0",
      "p_art": null,
      "sicherheit": "tief",
      "sicherheit_begruendung": "Verfügbarkeit von KI-Offertfunktionen in verbreiteten KMU-ERPs ist unklar und Preise/Konditionen erfordern Abklärung; E0 fast ebenso plausibel.",
      "ch_hemmnis": [],
      "begruendung": "ERP-Copilot erstellt aus der Anfrage einen Offertentwurf mit Artikeln, Preisen und Begleittext; die Person prüft jede Offerte auf Positionen und Konditionen."
    },
    {
      "name": "Eingangsrechnungen erfassen, kontieren und zur Visierung weiterleiten",
      "zeitanteil_pct": 10,
      "stufe": "E2",
      "modus": "ersetzend",
      "restzeit_mensch": "10-30",
      "physisch_automatisierbar": "P1",
      "p_art": "software",
      "sicherheit": "mittel",
      "sicherheit_begruendung": null,
      "ch_hemmnis": [],
      "begruendung": "KI-Belegerfassung in der Buchhaltungssoftware erfasst und kontiert; die Person bearbeitet markierte Ausnahmen. P1: QR-Rechnungs-Einlesen und klassische lernende Kreditoren-Scanlösungen übernehmen bereits den Grossteil."
    },
    {
      "name": "Rechnungen aus Aufträgen fakturieren, Zahlungseingänge abgleichen und Mahnläufe durchführen",
      "zeitanteil_pct": 5,
      "stufe": "E0",
      "modus": null,
      "restzeit_mensch": null,
      "physisch_automatisierbar": "P1",
      "p_art": "software",
      "sicherheit": "hoch",
      "sicherheit_begruendung": null,
      "ch_hemmnis": [],
      "begruendung": "Fakturierung, Zahlungsabgleich per QR-Referenz und Mahnlauf sind klassische ERP-/Buchhaltungsfunktionen, kein LLM nötig."
    },
    {
      "name": "Kunden- und Stammdaten pflegen, Mutationen aus Formularen und Mitteilungen erfassen und Dokumente digital ablegen",
      "zeitanteil_pct": 10,
      "stufe": "E2",
      "modus": "ersetzend",
      "restzeit_mensch": "10-30",
      "physisch_automatisierbar": "P0",
      "p_art": null,
      "sicherheit": "mittel",
      "sicherheit_begruendung": null,
      "ch_hemmnis": [],
      "begruendung": "KI-Extraktion aus Freitext-E-Mails und Formularen mit Systemintegration bzw. automatische Klassifikation im DMS erledigt die Erfassung; die Person prüft markierte Unklarheiten und Stichproben."
    },
    {
      "name": "Termine koordinieren, Sitzungen und Geschäftsreisen organisieren und Einladungen versenden",
      "zeitanteil_pct": 10,
      "stufe": "E2",
      "modus": "delegierend",
      "restzeit_mensch": "30-50",
      "physisch_automatisierbar": "P0",
      "p_art": null,
      "sicherheit": "tief",
      "sicherheit_begruendung": "Unklar, ob Kalender-Agenten im KMU-Alltag (Rückfragen, Umbuchungen, informelle Absprachen) wirklich 50 % sparen; E0 ebenso plausibel.",
      "ch_hemmnis": [],
      "begruendung": "Ein Assistenz-Agent in der Office-Suite schlägt Termine vor, entwirft Einladungen und Buchungen; die Person gibt Vorgaben und prüft jede Buchung und Einladung."
    },
    {
      "name": "Sitzungsprotokolle aus Aufnahmen oder Notizen erstellen",
      "zeitanteil_pct": 5,
      "stufe": "E2",
      "modus": "delegierend",
      "restzeit_mensch": "30-50",
      "physisch_automatisierbar": "P0",
      "p_art": null,
      "sicherheit": "mittel",
      "sicherheit_begruendung": null,
      "ch_hemmnis": [],
      "begruendung": "Transkription und Zusammenfassung erstellen das Protokoll; weil Sitzungen meist in Mundart mit mehreren Personen stattfinden, liest die Person jedes Protokoll inhaltlich gegen und korrigiert Namen, Beschlüsse und Fehler."
    },
    {
      "name": "Auswertungen in Excel und Präsentationen für Vorgesetzte erstellen",
      "zeitanteil_pct": 5,
      "stufe": "E2",
      "modus": "delegierend",
      "restzeit_mensch": "30-50",
      "physisch_automatisierbar": "P0",
      "p_art": null,
      "sicherheit": "mittel",
      "sicherheit_begruendung": null,
      "ch_hemmnis": [],
      "begruendung": "KI-Funktionen in Excel und PowerPoint erstellen Pivot-Auswertungen, Diagramme und Folienentwürfe nach Vorgabe; die Person prüft Zahlen und passt die Gestaltung an."
    },
    {
      "name": "Post und Pakete entgegennehmen, verteilen und versenden, Papierablage führen und Büromaterial nachbestellen",
      "zeitanteil_pct": 5,
      "stufe": "E0",
      "modus": null,
      "restzeit_mensch": null,
      "physisch_automatisierbar": "P0",
      "p_art": null,
      "sicherheit": "hoch",
      "sicherheit_begruendung": null,
      "ch_hemmnis": [],
      "begruendung": "Überwiegend physische Handgriffe im Büro; Frankiermaschinen sind bereits Standard, der Rest ist nicht in relevantem Umfang automatisierbar."
    }
  ],
  "unsicherheit": "mittel",
  "kommentar": "Setting: Kaufmann/-frau EFZ als Sachbearbeiter/in Innendienst/Administration in einem Dienstleistungs- oder Handels-KMU. ESCO «Büroassistent/in» (nach Korrektur) bildet die CH-Grundbildung nur teilweise ab; Auftragsabwicklung und Kreditoren wurden aus Berufswissen ergänzt. Grenzfälle: Telefon (Voicebot vs. E0), Terminorganisation und Offerten (Verfügbarkeit von KI-Funktionen in KMU-Software)."
}
