{
  "isco_code": "2341",
  "beruf": "Primarlehrer/in",
  "taetigkeiten": [
    {
      "name": "Lektionen im Klassenzimmer halten, Lernende beim Lernen begleiten und Klasse führen",
      "zeitanteil_pct": 50,
      "stufe": "E0",
      "modus": null,
      "restzeit_mensch": null,
      "physisch_automatisierbar": "P0",
      "p_art": null,
      "sicherheit": "hoch",
      "sicherheit_begruendung": null,
      "ch_hemmnis": [],
      "begruendung": "Präsenz- und Beziehungstätigkeit vor der Klasse; Unterricht, Klassenführung und Betreuung von Kindern lassen sich nicht an KI übergeben."
    },
    {
      "name": "Pausenaufsicht übernehmen sowie Exkursionen, Schulreisen und Lager begleiten",
      "zeitanteil_pct": 4,
      "stufe": "E0",
      "modus": null,
      "restzeit_mensch": null,
      "physisch_automatisierbar": "P0",
      "p_art": null,
      "sicherheit": "hoch",
      "sicherheit_begruendung": null,
      "ch_hemmnis": [],
      "begruendung": "Physische Präsenz und Aufsichtspflicht."
    },
    {
      "name": "Unterrichtseinheiten und Lektionen nach Lehrplan 21 planen",
      "zeitanteil_pct": 8,
      "stufe": "E1",
      "modus": "unterstützend",
      "restzeit_mensch": "30-50",
      "physisch_automatisierbar": "P0",
      "p_art": null,
      "sicherheit": "tief",
      "sicherheit_begruendung": "Planung geschieht oft im Kopf und anhand der Lehrmittel; ob LLM-Vorschläge 50 % sparen, ist offen, E0 ebenso plausibel.",
      "ch_hemmnis": [],
      "begruendung": "Die Lehrperson plant selbst mit Blick auf ihre Klasse; das LLM schlägt Sequenzen, Lernziele und Methoden zu eingefügten Lehrplan-Kompetenzen vor."
    },
    {
      "name": "Arbeitsblätter, Übungen und Lernkontrollen erstellen und differenzieren",
      "zeitanteil_pct": 7,
      "stufe": "E1",
      "modus": "delegierend",
      "restzeit_mensch": "30-50",
      "physisch_automatisierbar": "P0",
      "p_art": null,
      "sicherheit": "mittel",
      "sicherheit_begruendung": null,
      "ch_hemmnis": [],
      "begruendung": "Das LLM erstellt Blätter und Prüfungen samt Niveauvarianten; die Lehrperson prüft und passt jedes Blatt an die Klasse an."
    },
    {
      "name": "Unterrichtsmaterial bereitstellen, kopieren und Schulzimmer bzw. Experimente einrichten",
      "zeitanteil_pct": 4,
      "stufe": "E0",
      "modus": null,
      "restzeit_mensch": null,
      "physisch_automatisierbar": "P0",
      "p_art": null,
      "sicherheit": "hoch",
      "sicherheit_begruendung": null,
      "ch_hemmnis": [],
      "begruendung": "Physische Vorbereitung im Schulhaus."
    },
    {
      "name": "Handschriftliche Übungen und Prüfungen mit eindeutigen Lösungen (Mathematik, Rechtschreibung) korrigieren",
      "zeitanteil_pct": 4,
      "stufe": "E2",
      "modus": "unterstützend",
      "restzeit_mensch": "30-50",
      "physisch_automatisierbar": "P0",
      "p_art": null,
      "sicherheit": "tief",
      "sicherheit_begruendung": "Handschrifterkennung bei Kinderschrift und der Aufwand für Scannen sind unsicher; E0 ebenso plausibel.",
      "ch_hemmnis": ["regulatorisch"],
      "begruendung": "Handschrifterkennung und Fehlermarkierung nach dem Einscannen; die Lehrperson sieht jede Arbeit selbst durch und bewertet. Hemmnis: Datenschutz bei Schülerdaten in Cloud-Diensten."
    },
    {
      "name": "Freie Schülertexte, Projekt- und Gestaltungsarbeiten beurteilen und Rückmeldungen geben",
      "zeitanteil_pct": 4,
      "stufe": "E0",
      "modus": null,
      "restzeit_mensch": null,
      "physisch_automatisierbar": "P0",
      "p_art": null,
      "sicherheit": "mittel",
      "sicherheit_begruendung": null,
      "ch_hemmnis": [],
      "begruendung": "Handschriftliche bzw. gestalterische Arbeiten von Kindern; die Beurteilung erfordert Kenntnis des Kindes, KI spart keine 50 %."
    },
    {
      "name": "Lernberichte, Zeugnisbemerkungen und Förderpläne aus Beobachtungsnotizen formulieren",
      "zeitanteil_pct": 3,
      "stufe": "E1",
      "modus": "delegierend",
      "restzeit_mensch": "30-50",
      "physisch_automatisierbar": "P0",
      "p_art": null,
      "sicherheit": "mittel",
      "sicherheit_begruendung": null,
      "ch_hemmnis": ["regulatorisch"],
      "begruendung": "Das LLM formuliert Berichte aus Stichworten zur Lernentwicklung; die Lehrperson prüft und verantwortet jeden Bericht. Hemmnis: Datenschutz bei Schülerdaten."
    },
    {
      "name": "Eltern- und Standortgespräche führen und Elternabende durchführen",
      "zeitanteil_pct": 5,
      "stufe": "E0",
      "modus": null,
      "restzeit_mensch": null,
      "physisch_automatisierbar": "P0",
      "p_art": null,
      "sicherheit": "hoch",
      "sicherheit_begruendung": null,
      "ch_hemmnis": [],
      "begruendung": "Persönliche Gespräche von Angesicht zu Angesicht; Beziehungstätigkeit."
    },
    {
      "name": "Elternbriefe, Mitteilungen und E-Mails an Eltern schreiben",
      "zeitanteil_pct": 3,
      "stufe": "E1",
      "modus": "delegierend",
      "restzeit_mensch": "10-30",
      "physisch_automatisierbar": "P0",
      "p_art": null,
      "sicherheit": "mittel",
      "sicherheit_begruendung": null,
      "ch_hemmnis": [],
      "begruendung": "Das LLM entwirft Mitteilungen aus Stichworten, auch in Übersetzung für fremdsprachige Eltern; die Lehrperson prüft jede vor dem Versand."
    },
    {
      "name": "Mit Schulteam, Heilpädagogik, DaZ-Lehrpersonen und Schulleitung zusammenarbeiten und an Sitzungen und Schulanlässen mitwirken",
      "zeitanteil_pct": 8,
      "stufe": "E0",
      "modus": null,
      "restzeit_mensch": null,
      "physisch_automatisierbar": "P0",
      "p_art": null,
      "sicherheit": "hoch",
      "sicherheit_begruendung": null,
      "ch_hemmnis": [],
      "begruendung": "Absprachen und Zusammenarbeit in Präsenz."
    }
  ],
  "unsicherheit": "niedrig",
  "kommentar": "Setting: Klassenlehrperson an einer öffentlichen Primarschule (Mittelstufe, 3.–6. Klasse) in der Deutschschweiz, hohes Pensum. Input passt gut. Grenzfälle: Unterrichtsplanung (E1 unterstützend vs. E0) und Korrektur handschriftlicher Arbeiten."
}
