{
  "isco_code": "2166",
  "beruf": "Grafiker/in",
  "taetigkeiten": [
    {
      "name": "Briefings mit Kundschaft führen, Anforderungen klären und Entwürfe präsentieren",
      "zeitanteil_pct": 10,
      "stufe": "E0",
      "modus": null,
      "restzeit_mensch": null,
      "physisch_automatisierbar": "P0",
      "p_art": null,
      "sicherheit": "hoch",
      "sicherheit_begruendung": null,
      "ch_hemmnis": [],
      "begruendung": "Persönliche Abstimmung und Präsentation mit der Kundschaft; Wert liegt im Gespräch und im Verständnis der Kundenbedürfnisse."
    },
    {
      "name": "Gestaltungsideen und visuelle Konzepte für Kampagnen, Logos und Erscheinungsbilder entwickeln",
      "zeitanteil_pct": 15,
      "stufe": "E0",
      "modus": null,
      "restzeit_mensch": null,
      "physisch_automatisierbar": "P0",
      "p_art": null,
      "sicherheit": "mittel",
      "sicherheit_begruendung": null,
      "ch_hemmnis": [],
      "begruendung": "Ideenfindung und konzeptionelle Entscheidungen im Kundenprozess dominieren; generative KI spart hier nach bester Einschätzung keine 50 % bei gleicher Qualität (Varianten-Produktion separat erfasst)."
    },
    {
      "name": "Moodboards, Scribbles und Gestaltungsvarianten für ein Konzept erstellen",
      "zeitanteil_pct": 10,
      "stufe": "E2",
      "modus": "delegierend",
      "restzeit_mensch": "30-50",
      "physisch_automatisierbar": "P0",
      "p_art": null,
      "sicherheit": "mittel",
      "sicherheit_begruendung": null,
      "ch_hemmnis": [],
      "begruendung": "Bildgeneratoren in der Grafiksoftware erstellen Varianten und Moodboards in einem Bruchteil der Zeit; die Grafikerin steuert per Prompt und Referenzen, wählt aus und prüft jede Variante."
    },
    {
      "name": "Neue Print-Layouts (Broschüren, Plakate, Inserate, Geschäftsberichte) nach CI im Detail gestalten",
      "zeitanteil_pct": 15,
      "stufe": "E0",
      "modus": null,
      "restzeit_mensch": null,
      "physisch_automatisierbar": "P0",
      "p_art": null,
      "sicherheit": "tief",
      "sicherheit_begruendung": "Generative Layoutfunktionen (Auto-Layout, generatives Füllen) entwickeln sich schnell; E2 unterstützend mit Restzeit 30-50 ist fast ebenso plausibel.",
      "ch_hemmnis": [],
      "begruendung": "Detaillierte Typografie und Layout nach strengem CI erarbeitet die Grafikerin weitgehend selbst; generative Layoutfunktionen helfen punktuell, sparen aber nach bester Einschätzung keine 50 %."
    },
    {
      "name": "Grafiken für digitale Kanäle (Social-Media-Visuals, Banner, Web-Grafiken) aus bestehenden Vorlagen gestalten",
      "zeitanteil_pct": 10,
      "stufe": "E2",
      "modus": "delegierend",
      "restzeit_mensch": "30-50",
      "physisch_automatisierbar": "P0",
      "p_art": null,
      "sicherheit": "mittel",
      "sicherheit_begruendung": null,
      "ch_hemmnis": [],
      "begruendung": "Generative Design- und Bildfunktionen (Text-zu-Bild, generatives Füllen, Vorlagen-Varianten) erstellen die Grafiken im CI-Rahmen; die Grafikerin gibt Vorgaben und prüft und korrigiert jede Grafik."
    },
    {
      "name": "Bilder freistellen, retuschieren, erweitern und zu Bildmontagen zusammenführen",
      "zeitanteil_pct": 10,
      "stufe": "E2",
      "modus": "delegierend",
      "restzeit_mensch": "10-30",
      "physisch_automatisierbar": "P0",
      "p_art": null,
      "sicherheit": "mittel",
      "sicherheit_begruendung": null,
      "ch_hemmnis": [],
      "begruendung": "Generative Bildbearbeitung (Freistellen, Retusche, generatives Erweitern) erledigt die Arbeit in Sekunden; die Grafikerin steuert und kontrolliert jedes Bild auf Qualität und Artefakte."
    },
    {
      "name": "Bestehende Layouts in weitere Formate, Sprachversionen und Kanäle adaptieren",
      "zeitanteil_pct": 10,
      "stufe": "E2",
      "modus": "delegierend",
      "restzeit_mensch": "10-30",
      "physisch_automatisierbar": "P0",
      "p_art": null,
      "sicherheit": "mittel",
      "sicherheit_begruendung": null,
      "ch_hemmnis": [],
      "begruendung": "Generative Layout- und Übersetzungsfunktionen in der Grafiksoftware erstellen die Fassungen; die Grafikerin kontrolliert jede Fassung (Umbrüche, Typografie)."
    },
    {
      "name": "Druckdaten aufbereiten, Preflight durchführen und mit der Druckerei abstimmen",
      "zeitanteil_pct": 5,
      "stufe": "E0",
      "modus": null,
      "restzeit_mensch": null,
      "physisch_automatisierbar": "P1",
      "p_art": "software",
      "sicherheit": "mittel",
      "sicherheit_begruendung": null,
      "ch_hemmnis": [],
      "begruendung": "Preflight, Farbprofile und PDF-Export sind klassische Software (Preflight-Profile, automatische Druck-PDF-Erzeugung) und übernehmen den Grossteil; Abstimmung mit der Druckerei bleibt."
    },
    {
      "name": "Text- und Gestaltungskorrekturen der Kundschaft in Layouts einarbeiten",
      "zeitanteil_pct": 5,
      "stufe": "E0",
      "modus": null,
      "restzeit_mensch": null,
      "physisch_automatisierbar": "P0",
      "p_art": null,
      "sicherheit": "mittel",
      "sicherheit_begruendung": null,
      "ch_hemmnis": [],
      "begruendung": "Kleinteilige Korrekturen am Layout führt die Grafikerin von Hand aus; KI spart bei typischen Korrekturschlaufen keine 50 %."
    },
    {
      "name": "Kurztexte, Headlines und Bildlegenden für Entwürfe formulieren",
      "zeitanteil_pct": 5,
      "stufe": "E1",
      "modus": "delegierend",
      "restzeit_mensch": "10-30",
      "physisch_automatisierbar": "P0",
      "p_art": null,
      "sicherheit": "mittel",
      "sicherheit_begruendung": null,
      "ch_hemmnis": [],
      "begruendung": "Reine Textaufgabe: das Chat-LLM formuliert Headline- und Textvorschläge aus dem Briefing; die Grafikerin wählt aus und prüft jeden Text."
    },
    {
      "name": "Offerten und Kundenkorrespondenz schreiben, Projektaufwand erfassen",
      "zeitanteil_pct": 5,
      "stufe": "E1",
      "modus": "delegierend",
      "restzeit_mensch": "30-50",
      "physisch_automatisierbar": "P0",
      "p_art": null,
      "sicherheit": "mittel",
      "sicherheit_begruendung": null,
      "ch_hemmnis": [],
      "begruendung": "Offerten- und Mailentwürfe aus Stichworten erstellt das Chat-LLM; die Grafikerin prüft Leistungsumfang und Preise jedes Mal; Stundenerfassung ist marginal."
    }
  ],
  "unsicherheit": "mittel",
  "kommentar": "Setting: Grafikerin/Grafiker in kleiner Agentur oder Inhouse-Kommunikation, Print und Digital. Hauptgrenzfall ist die detaillierte Layoutgestaltung nach CI (E0 vs. E2 unterstützend); Zeitanteile zwischen Konzept, Layout und Adaption grob geschätzt."
}
