{
  "isco_code": "8332",
  "beruf": "Lastwagenfahrer/in",
  "taetigkeiten": [
    {
      "name": "Lastwagen im regulären Strassennetz fahren, manövrieren und einparken",
      "zeitanteil_pct": 55,
      "stufe": "E0",
      "modus": null,
      "restzeit_mensch": null,
      "physisch_automatisierbar": "P0",
      "p_art": null,
      "sicherheit": "hoch",
      "sicherheit_begruendung": null,
      "ch_hemmnis": [],
      "begruendung": "Physisch; fahrerloser Lkw-Verkehr ist in der Schweiz 2026 weder zugelassen noch verfügbar, Assistenzsysteme ersetzen die Fahrperson nicht."
    },
    {
      "name": "Fracht be- und entladen und Ladung sichern (Hebebühne, Ladekran, Hubwagen)",
      "zeitanteil_pct": 15,
      "stufe": "E0",
      "modus": null,
      "restzeit_mensch": null,
      "physisch_automatisierbar": "P0",
      "p_art": null,
      "sicherheit": "hoch",
      "sicherheit_begruendung": null,
      "ch_hemmnis": [],
      "begruendung": "Physische Arbeit an wechselnden Abladestellen; automatische Verladesysteme gibt es nur an einzelnen Rampen grosser Logistikzentren."
    },
    {
      "name": "Abfahrtskontrolle durchführen, Fahrzeug pflegen und kleine Wartungen erledigen",
      "zeitanteil_pct": 5,
      "stufe": "E0",
      "modus": null,
      "restzeit_mensch": null,
      "physisch_automatisierbar": "P0",
      "p_art": null,
      "sicherheit": "hoch",
      "sicherheit_begruendung": null,
      "ch_hemmnis": [],
      "begruendung": "Physische Sichtkontrolle und Handgriffe am Fahrzeug; Fahrzeugdiagnose unterstützt nur."
    },
    {
      "name": "Ware beim Empfänger übergeben und Lieferung quittieren lassen",
      "zeitanteil_pct": 5,
      "stufe": "E0",
      "modus": null,
      "restzeit_mensch": null,
      "physisch_automatisierbar": "P0",
      "p_art": null,
      "sicherheit": "hoch",
      "sicherheit_begruendung": null,
      "ch_hemmnis": [],
      "begruendung": "Präsenz beim Kunden und physische Übergabe; elektronische Quittierung ist bereits Teil des Ablaufs und kostet kaum Zeit."
    },
    {
      "name": "Lieferpapiere, Frachtbriefe und Zolldokumente kontrollieren und Lieferungen im Handscanner erfassen",
      "zeitanteil_pct": 5,
      "stufe": "E0",
      "modus": null,
      "restzeit_mensch": null,
      "physisch_automatisierbar": "P0",
      "p_art": null,
      "sicherheit": "mittel",
      "sicherheit_begruendung": null,
      "ch_hemmnis": [],
      "begruendung": "Abgleich der Papiere mit der realen Ladung vor Ort und Barcode-Erfassung (klassische Technik, bereits im Einsatz); generative KI spart dabei keine 50 %."
    },
    {
      "name": "Tagestour und Route planen, Verkehrsinformationen prüfen",
      "zeitanteil_pct": 5,
      "stufe": "E0",
      "modus": null,
      "restzeit_mensch": null,
      "physisch_automatisierbar": "P1",
      "p_art": "software",
      "sicherheit": "mittel",
      "sicherheit_begruendung": null,
      "ch_hemmnis": [],
      "begruendung": "Tour wird meist durch Disposition und Navigations- bzw. Tourenplanungssoftware vorgegeben (klassische Software, kein LLM)."
    },
    {
      "name": "Fracht nach Gewicht, Volumen und Abladereihenfolge auf dem Fahrzeug einteilen",
      "zeitanteil_pct": 5,
      "stufe": "E0",
      "modus": null,
      "restzeit_mensch": null,
      "physisch_automatisierbar": "P0",
      "p_art": null,
      "sicherheit": "mittel",
      "sicherheit_begruendung": null,
      "ch_hemmnis": [],
      "begruendung": "Einteilung erfolgt beim Laden an der Rampe anhand der realen Ware; Ladeplanungssoftware wird im Verteilverkehr selten genutzt und ersetzt die Person nicht."
    },
    {
      "name": "Mit Disposition und Kunden kommunizieren, Verspätungen und Schäden melden",
      "zeitanteil_pct": 5,
      "stufe": "E0",
      "modus": null,
      "restzeit_mensch": null,
      "physisch_automatisierbar": "P0",
      "p_art": null,
      "sicherheit": "mittel",
      "sicherheit_begruendung": null,
      "ch_hemmnis": [],
      "begruendung": "Kurze Telefonate und App-Meldungen unterwegs; generative KI spart bei diesen knappen Kontakten keine relevante Zeit."
    }
  ],
  "unsicherheit": "niedrig",
  "kommentar": "Setting: Chauffeur/in Kat. C/CE im regionalen Verteil- und Baustoffverkehr eines Transportunternehmens. ESCO-Beschreibung sehr knapp; Tätigkeiten aus Kompetenzliste und Berufswissen. Fahren dominiert; keine KI-exponierte Tätigkeit, Tourenplanung ist klassische Software."
}
