{
  "isco_code": "2431",
  "beruf": "Fachkräfte in Marketing und Werbung",
  "taetigkeiten": [
    {
      "name": "Markt-, Wettbewerbs- und Zielgruppenanalysen recherchieren und aufbereiten",
      "zeitanteil_pct": 10,
      "stufe": "E2",
      "modus": "delegierend",
      "restzeit_mensch": "30-50",
      "physisch_automatisierbar": "P0",
      "p_art": null,
      "sicherheit": "mittel",
      "sicherheit_begruendung": null,
      "ch_hemmnis": [],
      "begruendung": "Recherche-Agenten mit Websuche erstellen Analysen mit Quellen; die Marketingfachperson spezifiziert die Fragestellung und prüft jede Analyse gegen Quellen und Marktkenntnis."
    },
    {
      "name": "Marketingkonzepte und Massnahmenpläne schriftlich ausarbeiten",
      "zeitanteil_pct": 10,
      "stufe": "E1",
      "modus": "delegierend",
      "restzeit_mensch": "30-50",
      "physisch_automatisierbar": "P0",
      "p_art": null,
      "sicherheit": "mittel",
      "sicherheit_begruendung": null,
      "ch_hemmnis": [],
      "begruendung": "Aus Zielen, Budget und Analysen entwirft das LLM Konzept und Massnahmenplan; die Fachperson steuert die Inhalte und prüft und überarbeitet jeden Entwurf."
    },
    {
      "name": "Positionierung und Marketingstrategie mit der Geschäftsleitung abstimmen und entscheiden",
      "zeitanteil_pct": 5,
      "stufe": "E0",
      "modus": null,
      "restzeit_mensch": null,
      "physisch_automatisierbar": "P0",
      "p_art": null,
      "sicherheit": "hoch",
      "sicherheit_begruendung": null,
      "ch_hemmnis": [],
      "begruendung": "Strategische Entscheidung im Gespräch mit der Geschäftsleitung; Ermessen und Verantwortung."
    },
    {
      "name": "Kampagnen koordinieren und mit Agenturen, Druckereien und internen Stellen abstimmen",
      "zeitanteil_pct": 10,
      "stufe": "E0",
      "modus": null,
      "restzeit_mensch": null,
      "physisch_automatisierbar": "P0",
      "p_art": null,
      "sicherheit": "mittel",
      "sicherheit_begruendung": null,
      "ch_hemmnis": [],
      "begruendung": "Projektkoordination in Sitzungen und Telefonaten; KI spart hier nach bester Einschätzung keine 50 %."
    },
    {
      "name": "Werbe- und Kommunikationstexte für Website, Newsletter, Broschüren und Inserate verfassen",
      "zeitanteil_pct": 15,
      "stufe": "E1",
      "modus": "delegierend",
      "restzeit_mensch": "10-30",
      "physisch_automatisierbar": "P0",
      "p_art": null,
      "sicherheit": "mittel",
      "sicherheit_begruendung": null,
      "ch_hemmnis": [],
      "begruendung": "Das LLM schreibt die Texte aus Briefing und Tonalitätsvorgaben; die Fachperson prüft und korrigiert jeden Text vor der Publikation."
    },
    {
      "name": "Social-Media-Beiträge mit Bild erstellen und einplanen",
      "zeitanteil_pct": 15,
      "stufe": "E2",
      "modus": "delegierend",
      "restzeit_mensch": "30-50",
      "physisch_automatisierbar": "P0",
      "p_art": null,
      "sicherheit": "mittel",
      "sicherheit_begruendung": null,
      "ch_hemmnis": [],
      "begruendung": "Text wäre E1, Bilderzeugung und -bearbeitung braucht Zusatzsoftware; die KI erstellt Text und Bild, die Fachperson wählt aus und prüft jeden Post."
    },
    {
      "name": "Online-Werbekampagnen (Suchmaschinen-, Social-Ads) aufsetzen und optimieren",
      "zeitanteil_pct": 10,
      "stufe": "E2",
      "modus": "delegierend",
      "restzeit_mensch": "30-50",
      "physisch_automatisierbar": "P0",
      "p_art": null,
      "sicherheit": "mittel",
      "sicherheit_begruendung": null,
      "ch_hemmnis": [],
      "begruendung": "Generative Funktionen der Werbeplattformen erstellen Anzeigentexte, Bildvarianten und Zielgruppenvorschläge; die Fachperson gibt Ziele und Budget vor und prüft jede Kampagne. Gebotssteuerung ist bereits automatisiert."
    },
    {
      "name": "Kampagnenerfolg auswerten und Reportings mit Handlungsempfehlungen erstellen",
      "zeitanteil_pct": 10,
      "stufe": "E2",
      "modus": "delegierend",
      "restzeit_mensch": "30-50",
      "physisch_automatisierbar": "P0",
      "p_art": null,
      "sicherheit": "mittel",
      "sicherheit_begruendung": null,
      "ch_hemmnis": [],
      "begruendung": "Analyse-Agent mit Code-Ausführung wertet Exporte aus Web-Analytics und Werbeplattformen aus und formuliert Erkenntnisse; die Fachperson prüft jede Auswertung. Klassische Dashboards liefern nur Zahlen, nicht die Interpretation."
    },
    {
      "name": "Kundenkontakte und Partnerbeziehungen pflegen, Messen und Events betreuen",
      "zeitanteil_pct": 5,
      "stufe": "E0",
      "modus": null,
      "restzeit_mensch": null,
      "physisch_automatisierbar": "P0",
      "p_art": null,
      "sicherheit": "hoch",
      "sicherheit_begruendung": null,
      "ch_hemmnis": [],
      "begruendung": "Persönlicher Kontakt und Präsenz an Anlässen."
    },
    {
      "name": "Kundenbefragungen konzipieren und auswerten",
      "zeitanteil_pct": 5,
      "stufe": "E2",
      "modus": "delegierend",
      "restzeit_mensch": "30-50",
      "physisch_automatisierbar": "P0",
      "p_art": null,
      "sicherheit": "mittel",
      "sicherheit_begruendung": null,
      "ch_hemmnis": [],
      "begruendung": "Das LLM entwirft den Fragebogen, Analysewerkzeuge werten offene und geschlossene Antworten aus; die Fachperson prüft Fragebogen und Auswertung."
    },
    {
      "name": "Marketingbudget überwachen, Offerten vergleichen und Rechnungen visieren",
      "zeitanteil_pct": 5,
      "stufe": "E0",
      "modus": null,
      "restzeit_mensch": null,
      "physisch_automatisierbar": "P1",
      "p_art": "software",
      "sicherheit": "mittel",
      "sicherheit_begruendung": null,
      "ch_hemmnis": [],
      "begruendung": "Budgetkontrolle läuft über Tabellen und Controlling-Software (klassische Software); visieren ist ein kurzer Entscheid."
    }
  ],
  "unsicherheit": "mittel",
  "kommentar": "Setting: Marketingfachperson (eidg. FA) in der Marketingabteilung eines KMU mit breitem Aufgabenfeld. Die ISCO-Gruppe ist heterogen (Strategie, Kommunikation, Online-Marketing); Zeitanteile grob geschätzt. Hauptfrage ist das Restzeit-Band bei Texten (10-30 vs. 30-50)."
}
